id,ai_role,ai_role_other,camera_role,camera_role_other,human_role,human_role_other,painting_role,painting_role_other,obsolete_systems,obsolete_other,free_response,ip_address,submitted_at
qr_aa9c9fb6,"[""system""]",,"[""other""]","a viewfinder, a pathway for light","[""artist""]",,"[""medium""]",,"[""painting""]",,,::1,2025-12-09 22:50:47
qr_73ac9074,"[""system""]",,"[""other""]",a sensor,"[""artist""]",,"[""medium""]",,"[""AI""]",,i think AI as currently defined and thought of will become obsolete before the others. ,::1,2025-12-09 23:49:04
qr_bb2f5437,"[""system""]",,"[""system""]",,"[""other""]",a system for guarding tables,"[""medium""]",,"[""AI"",""camera"",""painting""]",,,::1,2025-12-09 23:54:46
qr_77159c47,"[""system""]",,"[""other""]",tool,"[""artist""]",,"[""other""]",art and expression,"[""painting""]",,"ai is a tool, tools do not have emotion",::1,2025-12-10 00:22:52
qr_c7f46f6e,"[""system""]",,"[""medium""]",,"[""artist""]",,"[""medium""]",,[],None!,"I don't tink that AI will truly ever replace the creativity and self-expression that making art requires & provides, but I think it has a great potential to financially hurt artists.",::1,2025-12-12 19:45:51
qr_987a20bf,"[""system""]",,"[""system""]",,"[""artist""]",,"[""medium""]",,[],,,::1,2025-12-12 19:47:11
qr_76893430,"[""system""]",,"[""other""]",A TOOL,"[""artist""]",,"[""other""]",METHOD OF SELF-EXPRESSION,"[""human"",""painting""]",,I THINK ART & ARTIST CAN NEVER BE REPLACED. NO ONE BUT UMAN CAN EXPRESS WHAT I MEANS TO BE HUMAN. ,::1,2025-12-12 19:48:35
qr_88b62d4f,"[""medium""]",,"[""medium""]",,"[""artist""]",,"[""medium""]",,"[""AI""]",,,::1,2025-12-12 19:48:51
qr_2c23856f,"[""medium""]",,"[""medium""]",,"[""artist"",""system""]",,"[""medium""]",,"[""camera""]",DIY; junk to treasure art/functional,,::1,2025-12-12 19:49:30
qr_6146861d,"[""system""]",,"[""system""]",,"[""artist""]",,"[""other""]",an art piece,[],None of the above,,::1,2025-12-12 19:50:32
qr_20367f65,"[""other""]",A TOOL,"[""other""]",A TOOL,"[""artist""]",,"[""medium""]",,[],NONE OF THE ABOVE,HEART EMOJI!!,::1,2025-12-12 19:55:49
qr_2e414fa4,"[""other""]",tool,"[""other""]",tool,"[""artist""]",,"[""medium""]",,[],idk,"Art's value is often measured by someone's relationship to it I anticipate that artists must rely on relational labor more to make a living from art since AI can outpace humans with the output / ""product""",::1,2025-12-12 21:55:03
qr_362748f0,"[""system""]",,"[""other""]",a tool,"[""artist"",""system""]",,"[""other""]",a trace of artistic action,[],None/All,,::1,2025-12-12 21:59:25
qr_673c67b2,"[""other""]",a storyteller ?,"[""medium""]",,"[""artist""]",,"[""other""]",Another story teller,[],None of them. They are just telling diff stories,,::1,2025-12-12 22:22:00
qr_6d05aa9a,"[""medium"",""system""]",,"[""medium""]",,"[""artist"",""medium"",""system""]",,"[""medium""]",,"[""AI""]",,"There will be newer, cooler emerging technology very soon to replace AI. But we love and enjoy human painting and documenting with camera and looking the world through other human, painting, cameras",::1,2025-12-12 22:28:56
qr_96965341,"[""system""]",,"[""other""]",a sensor,"[""artist""]",,"[""medium""]",,"[""human"",""painting""]",,,::1,2025-12-12 22:30:17
qr_a726017e,"[""other""]",what you make it,"[""other""]",what you make it,"[""other""]",a human <-- special,"[""other""]","human expression, no matter how it's done",[],choice over what we make of things,,::1,2025-12-12 22:31:51
qr_f11b4360,"[""medium"",""system""]",,"[""medium"",""system""]",,"[""artist"",""medium"",""system""]",,"[""medium"",""system""]",,"[""AI"",""camera"",""human"",""painting""]",,,::1,2025-12-12 22:32:19
qr_4a37efd6,"[""system""]",,"[""medium""]",,"[""artist""]",,"[""medium""]",,"[""human"",""painting""]",,,::1,2025-12-13 19:49:10
qr_74b9f7e7,"[""system""]",,"[""medium""]",,"[""artist""]",,"[""medium""]",,[],,,::1,2025-12-13 19:49:54
qr_49b6b831,"[""medium""]",,"[""medium""]",,"[""artist""]",,"[""medium""]",,"[""AI""]",,,::1,2025-12-13 20:21:17
qr_c86b40b3,"[""system""]",,"[""system""]",,"[""artist""]",,"[""artist""]",,"[""other""]",none?,"I think there will always be a space for human art, I think the human aspect will just be embedded into its value. Similar to how diamonds increase in value based off of their history and their story - art's value doesn't come purely from its aesthetic.",::1,2025-12-13 20:35:04
qr_74148149,"[""medium"",""system""]",,"[""medium"",""system""]",,"[""artist"",""medium""]",,"[""artist"",""medium""]",,"[""camera"",""painting""]",,,::1,2025-12-13 20:39:34
qr_cb9fbffd,"[""medium"",""system""]",,"[""medium""]",,"[""artist""]",,"[""medium""]",,[],,"i think art and media will evolve as our technology advances, in many exciting ways that are not all clear right now!",::1,2025-12-13 20:48:26
qr_8e16a1bd,"[""system""]",,"[""system""]",,"[""artist""]",,"[""medium""]",,"[""other""]",none,,::1,2025-12-13 20:53:13
qr_8af99919,"[""medium"",""system"",""other""]",a tool,"[""medium"",""system"",""other""]",a tool,"[""artist"",""medium""]",,"[""medium""]",,"[""other""]",each has its own utility and shoulod be preserved ,,::1,2025-12-13 21:26:44
qr_98c42eda,"[""system""]",,"[""other""]",a system for capturing images,"[""artist"",""medium"",""system"",""other""]",,"[""medium""]",,"[""AI""]",,,::1,2025-12-13 21:33:55
qr_5018f110,"[""system""]",,"[""medium"",""system""]",,"[""artist"",""medium""]",,"[""medium""]",,"[""camera"",""human"",""painting""]",,,::1,2025-12-13 21:39:26
